<Basket xmlns:xsi="http://www.w3.org/2001/XMLSchema-instance" 
        xsi:noNamespaceSchemaLocation="basket.xsd"
        language="en-AU" sold="true" time="03:25:51">
  <color>Paleturquoise</color>
  <date>2006-01-02</date>
  <dateTime>2006-01-02T03:26:14</dateTime>
  <fruit>grape</fruit>
  <vegetable>cucumber</vegetable>
  <berry>huckleberry</berry>
  <weight>1.234</weight>
</Basket>